{
  "evaluationRequestId": "66666666-6666-4666-8666-666666666666",
  "applicationId": "33333333-3333-4333-8333-333333333333",
  "applicationRevision": 1,
  "verificationId": "77777777-7777-4777-8777-777777777777",
  "asOfDate": "2026-10-13",
  "authorisedRetrievalReference": "demo-authorised-source-104"
}
